{
  "experiment_id": "ridgeview_winback_14d_holdout",
  "flow": "ridgeview_winback_14d",
  "unit": "user",
  "assignment": {
    "hash_field": "user_id",
    "salt": "ridgeview_winback_14d",
    "rule": "persistent, by user: bucket = first 7 hex digits of md5(user_id || ':ridgeview_winback_14d') mod 100; bucket < 15 is the holdout, computed in the daily queue query and pushed on the trigger event as in_holdout; holdout members enter, then exit at holdout_split, so both arms are the same population"
  },
  "holdout_share": 0.15,
  "primary_metric": {
    "event": "feature_used",
    "window_days": 30,
    "description": "created a report (feature_used where feature = reports) within 30 days of entry, treatment vs holdout, both arms counted from their entry date"
  },
  "plan": {
    "baseline": 0.1746,
    "mde_abs": 0.04365,
    "n_per_arm": {
      "holdout": 781,
      "treatment": 4426
    },
    "design_effect": 1.0,
    "alpha": 0.05,
    "power": 0.8,
    "read_on": null,
    "expected_read": "directional only"
  },
  "stopping_rule": {
    "design": "fixed_horizon",
    "looks": 1,
    "information_fractions": [
      1.0
    ],
    "alpha": 0.05
  },
  "status": "draft",
  "launched_on": null,
  "looks_taken": []
}